{
  "$schema": "http://json-schema.org/draft-04/schema#",
  "type": "object",
  "properties": {
    "Android": {
      "type": "array",
      "items": {
        "type": "object",
        "properties": {
          "Title": {
            "type": "string"
          },
          "Id": {
            "type": "string"
          },
          "Url": {
            "type": "string"
          },
          "Description": {
            "type": "string"
          }
        },
        "required": [
          "Title",
          "Id",
          "Url",
          "Description"
        ]
      }
    },
    "Books": {
      "type": "array",
      "items": {
        "type": "object",
        "properties": {
          "Title": {
            "type": "string"
          },
          "Author": {
            "type": "string"
          },
          "PublishYear": {
            "type": "integer"
          },
          "Url": {
            "type": "string"
          },
          "Description": {
            "type": "string"
          }
        },
        "required": [
          "Title",
          "Author",
          "PublishYear",
          "Url",
          "Description"
        ]
      }
    },
    "Data": {
      "type": "array",
      "items": {
        "type": "object",
        "properties": {
          "Title": {
            "type": "string"
          },
          "UserRepo": {
            "type": "string"
          },
          "Url": {
            "type": "string"
          },
          "Description": {
            "type": "string"
          }
        },
        "required": [
          "Title",
          "UserRepo",
          "Url",
          "Description"
        ]
      }
    },
    "Websites": {
      "type": "array",
      "items": {
        "type": "object",
        "properties": {
          "Title": {
            "type": "string"
          },
          "Url": {
            "type": "string"
          },
          "Description": {
            "type": "string"
          }
        },
        "required": [
          "Title",
          "Url",
          "Description"
        ]
      }
    },
    "iOS": {
      "type": "array",
      "items": {
        "type": "object",
        "properties": {
          "Title": {
            "type": "string"
          },
          "Url": {
            "type": "string"
          },
          "Description": {
            "type": "string"
          }
        },
        "required": [
          "Title",
          "Url",
          "Description"
        ]
      }
    }
  },
  "required": [
    "Android",
    "Books",
    "Data",
    "Websites",
    "iOS"
  ]
}
